"id","code","thumbnail","hero_image","title","category","is_vacant","is_green","leed_description","is_boma","geo_address_1","geo_address_2","geo_city","geo_province","geo_province_region","geo_country","geo_postal","geo_lat","geo_lng","geo_intersetion","sqft","vacant_sqft","description","marketing_pdf","video_url","siteplan_name","annual_average_daily_traffic","population_1km","household_1km","household_income_1km","population_3km","household_3km","household_income_3km","population_5km","household_5km","household_income_5km","social_facebook","social_twitter","social_url","vacancy_1","vacancy_2","vacancy_3","vacancy_4","vacancy_5","vacancy_6","vacancy_7","vacancy_8","vacancy_9","vacancy_10","filter_grocery_anchored","filter_urban_retail","filter_office_space","filter_under_development","sort_order","hidden","parent_name_fr","child_name_fr","leed_description_fr","geo_address_1_fr","geo_address_2_fr","geo_city_fr","geo_intersetion_fr","description_fr"
"141","ECR027","https://fcr.ca/uploads//properties/thumbs/ECR027_Thumb.jpg","https://fcr.ca/uploads//properties/hero/FCR_Ground2015_CarrefourCharlemagne_ 43.jpg","Carrefour Charlemagne","Charlemagne - Rona","0","1",NULL,"0","110 rue mile Despins",,"Charlemagne","QC","eastern","Canada","J5Z 3L6","45.7216573","-73.4912507","Autoroute 40 / Autoroute 640","139742",NULL,"<p>Charlemagne - Rona is located to the northeast of Montreal&rsquo;s downtown core in a community known for the birthplace of the iconic Celine Dion. Situated on a bustling street in close proximity to Autoroute 640 and 40, this centre is highly trafficked and is easily accessible. Featuring ample parking and key tenants such as Rona and Metro, this centre serves the everyday shopping needs of local residents.</p>
","https://fcr.ca/uploads/properties/marketing-pdfs/Galeries de Landaudiere_Group-Brochure.pdf",,"https://fcr.ca/uploads//properties/site-plans/Carrefour_Charlemagne.pdf","24000","3616","1786","67438","30652","12815","84071","63397","27094","83601",,,,"0","0","0","0","0","0","0","0","0","0","0","1","0","0","38","0",,,,,,,,"<p>Charlemagne - Rona est situ&eacute; au nord-est du centre-ville de Montr&eacute;al dans une communaut&eacute; connue pour le berceau de l&#39;ic&ocirc;ne C&eacute;line Dion.&nbsp;Situ&eacute; sur une rue anim&eacute;e &agrave; proximit&eacute; de l&#39;autoroute 640 et 40, ce centre est tr&egrave;s fr&eacute;quent&eacute; et est facilement accessible.&nbsp;Dot&eacute; d&#39;un grand parking et de locataires cl&eacute;s tels que Rona et Metro, ce centre sert aux besoins quotidiens des commer&ccedil;ants locaux. <!-- P--></p>
"
"142","ECC540","https://fcr.ca/uploads/properties/thumbs/ECC540_Thumb.jpg","https://fcr.ca/uploads//properties/hero/ECC540_header.jpg","Carrefour Charlemagne","Carrefour Charlemagne-Metro","1","1","2014 - LEED Canada New Construction (NC) v1.0 Certification","0","30-40 rue mile Despins",,"Charlemagne","QC","eastern","Canada","J5Z 3L6","45.7210889","-73.4950057","Autoroute 40 / Autoroute 640","48355",NULL,"<p>Carrefour Charlemagne - Metro is located to the northeast of Montreal&rsquo;s downtown core in a community known for the birthplace of the iconic Celine Dion. Situated on a bustling street in close proximity to Autoroute 640 and 40, this centre is highly trafficked and is easily accessible. Featuring ample parking and key tenants such as Rona and Metro, this centre serves the everyday shopping needs of local residents.</p>
","https://fcr.ca/uploads/properties/marketing-pdfs/Galeries de Landaudiere_Group-Brochure.pdf",,"https://fcr.ca/uploads//properties/site-plans/Carrefour_Charlemagne.pdf","24000","3616","1786","67438","30652","12815","84071","63397","27094","83601",,,,"1619","0","0","0","0","0","0","0","0","0","1","1","0","0","39","0",,,,,,,,"<p>Carrefour Charlemagne - M&eacute;tro est situ&eacute; au nord-est du centre-ville de Montr&eacute;al dans une communaut&eacute; connue pour le lieu de naissance de l&#39;ic&ocirc;ne C&eacute;line Dion.&nbsp;Situ&eacute; sur une rue anim&eacute;e &agrave; proximit&eacute; de l&#39;autoroute 640 et 40, ce centre est tr&egrave;s fr&eacute;quent&eacute; et est facilement accessible.&nbsp;Dot&eacute; d&#39;un grand parking et de locataires cl&eacute;s tels que Rona et Metro, ce centre sert les besoins quotidiens des residents locaux. <!-- P--></p>
"
"143","EGC361","https://fcr.ca/uploads//properties/thumbs/EGC361_Thumb.jpg","https://fcr.ca/uploads/properties/hero/EGC361_Ground4.jpg","Galeries des Chesnayes","Galeries des Chesnayes","1","1",NULL,"0","261-327 Monte des Pionniers",,"Lachenaie","QC","eastern","Canada","J6V 1H4","45.7116678","-73.5131947","Monte des Pionners / Boulevard Pierre-Laporte","65292",NULL,"<p>Located in Terrebonne&rsquo;s densely populated neighbourhood of Lachenaie is Galeries des Chesnayes. Strategically situated at exit 94 of Autoroute 40 and in close proximity to Galeries de Lanaudiere, this continuous strip of retail has high traffic counts and is easily accessible. With ample parking and key tenants such as IGA, Uniprix and SAQ, this centre well serves the residents in this growing community.</p>
","https://fcr.ca/uploads/properties/marketing-pdfs/Galeries de Landaudiere_Group-Brochure.pdf",,"https://fcr.ca/uploads//properties/site-plans/Galeries_des_Chesnaye.pdf","14000","6011","2208","104585","25293","10427","86574","53035","22355","82615",,,,"2914","0","0","0","0","0","0","0","0","0","0","1","0","0","88","0",,,,,,,,"<p><span helvetica="""" style=""font-family: adelle,;"">Les Galeries des Chesnayes sont situ&eacute;es &agrave; Lachenaie, quartier dens&eacute;ment peupl&eacute; de Terrebonne. Strat&eacute;giquement situ&eacute; &agrave; la sortie 94 de l&#39;autoroute 40 et &agrave; proximit&eacute; des Galeries de Lanaudi&egrave;re, cette bande continue de commerces est fortement achaland&eacute;e et facilement accessible. Avec un grand stationnement et des locataires cl&eacute;s tels qu&rsquo;IGA, Uniprix et SAQ, ce centre est id&eacute;al pour les r&eacute;sidents de cette communaut&eacute; en pleine croissance.</span> <!-- P--></p>
"
"144","ECS327","https://fcr.ca/uploads/properties/thumbs/ECS327_Thumb.jpg","https://fcr.ca/uploads/properties/hero/ECS327_Ground5.jpg","Carrefour St. Hubert","Carrefour St. Hubert","1","1","2015 - LEED Canada Core and Shell (CS) v1.0 Certification","1","5900 - 5950 Boulevard Cousineau",,"St-Hubert","QC","eastern","Canada","J3Y 7R9","45.4969118","-73.4078466","Boulevard Cousineau / Boulevard Gatan Boucher","165600",NULL,"<p>Carrefour St. Hubert Main B is located minutes away from downtown Montreal in the city of Longueuil. This historic town has become a vibrant neighbourhood for young families. Strategically located in an affluent community experiencing rapid growth, this centre offers an array of amenities. With an attractive mix of retail tenants featuring Jean Coutu, Super C, Dollarama, and SAQ. With ample parking, this centre offers a complete shopping experience for the residents of this growing community.</p>
","https://fcr.ca/uploads/properties/marketing-pdfs/St-Hubert.pdf",,"https://fcr.ca/uploads//properties/site-plans/Carrefour_St_Hubert.pdf","32242","12036","5218","74280","53113","21088","83245","132669","53460","80369",,,,"3700","3700","1189","1333","1191","0","0","0","0","0","1","1","1","0","48","0",,,,,,,,"<p><span style=""color: rgb(51, 51, 51); font-family: adelle, &quot;Helvetica Neue&quot;, Helvetica, Arial, sans-serif; font-size: 16px; background-color: rgb(255, 255, 255);"">Le Carrefour St-Hubert est situ&eacute; &agrave; quelques minutes du centre-ville de Montr&eacute;al, dans un quartier dynamique et familial de la ville de Longueuil. Strat&eacute;giquement situ&eacute; dans une communaut&eacute; ais&eacute;e, ce centre offre un &eacute;ventail de commodit&eacute;s. Avec une gamme attrayante de locataires tels que Jean Coutu, Super C, Dollarama et SAQ, ainsi qu&rsquo;un grand espace de stationnement, ce centre offre une exp&eacute;rience de magasinage compl&egrave;te pour les r&eacute;sidents de cette communaut&eacute; en pleine croissance.</span> <!-- P--></p>
"
"145","EPD410","https://fcr.ca/uploads/properties/thumbs/EPD410_Thumb.jpg","https://fcr.ca/uploads/properties/hero/EPD410_Ground3.jpg","Promenades du Parc","Promenades du Parc","1","1",NULL,"1","6250 Boulevard Cousineau",,"St-Hubert","QC","eastern","Canada","J3Y 8X9","45.4938893","-73.4065418","Boulevard Cousineau / Boulevard Gatan Boucher","104313",NULL,"<p>Nestled in the heart of an affluent community experiencing growth is Promenade du Parc. Located on a retail node adjacent to Carrefour St. Hubert Main B., this centre is a well situated property. With ample parking and key tenants such as IGA, National Bank of Canada and Pharmaprix, Promenade du Parc well serves the residents in the Saint Hubert community with their everyday shopping needs.</p>
","https://fcr.ca/uploads/properties/marketing-pdfs/St-Hubert.pdf",,"https://fcr.ca/uploads//properties/site-plans/Promenades_Du_Parc.pdf","32242","12513","5612","71724","51541","20253","84036","122462","49242","82791",,,,"2293","2521","1014","0","0","0","0","0","0","0","0","1","0","0","193","0",,,,,,,,"<p><span font-size:="""" helvetica="""" style=""font-family: adelle, "">Les Promenades du Parc se trouvent au c&oelig;ur d&#39;une communaut&eacute; qui conna&icirc;t une croissance continuelle. Dans un environnement commercial, &agrave; c&ocirc;t&eacute; du Carrefour Saint-Hubert, ce centre est un &eacute;tablissement strat&eacute;giquement situ&eacute;. Avec un grand espace de stationnement et des locataires cl&eacute;s tels qu&rsquo;IGA, Banque Nationale du Canada et Pharmaprix, les Promenades du Parc desservent bien les r&eacute;sidents de Saint Hubert pour leurs achats de tous les jours.</span> <!-- P--></p>
"
"146","EPA196","https://fcr.ca/uploads/properties/thumbs/EPA196_Thumb.jpg","https://fcr.ca/uploads/properties/hero/EPA196_Ground2.jpg","Plaza Actuel","Plaza Actuel","1","1",NULL,"1","5795-5869,5895,5925,5959 Boulevard Cousineau",,"St-Hubert","QC","eastern","Canada","J3Y 7P5","45.4953124","-73.4101643","Boulevard Cousineau / Boulevard Gatan Boucher","60107",NULL,"<p>Plaza Actuel is situated in the affluent Saint Hubert community surrounded by both residential and commercial development. Strategically situated close to Autoroute 30 on a retail node adjacent to Carrefour St. Hubert Main B and Promenade du Parc, the synergy of these three centres provide a complete shopping experience for the residents of this growing community.</p>
","https://fcr.ca/uploads/properties/marketing-pdfs/St-Hubert.pdf",,"https://fcr.ca/uploads//properties/site-plans/Plaza_Actuel.pdf","0","11734","5262","70664","54770","21739","82987","135743","54874","80318",,,,"1492","1500","0","0","0","0","0","0","0","0","0","1","0","0","188","0",,,,,,,,"<p>Plaza Actuel est situ&eacute; dans la communaut&eacute; affluent Saint Hubert entour&eacute;e &agrave; la fois par le d&eacute;veloppement r&eacute;sidentiel et commercial.&nbsp;Strat&eacute;giquement situ&eacute; &agrave; proximit&eacute; de l&#39;autoroute 30 dans un noeud de d&eacute;tail &agrave; c&ocirc;t&eacute; de Carrefour Saint-Hubert Main B et Promenade du Parc, la synergie de ces trois centres offrent une exp&eacute;rience de magasinage compl&egrave;te pour les r&eacute;sidents de cette communaut&eacute; en pleine croissance. <!-- P--></p>
"
"147","ECC648","https://fcr.ca/uploads/properties/thumbs/ECC648_Thumb.jpg","https://fcr.ca/uploads/properties/hero/ECC648_Ground2.jpg","Centre Commercial Maisonneuve","Centre Commercial Maisonneuve","0","1",NULL,"0","2925 - 3025 Rue Sherbrooke Est
",,"Montral","QC","eastern","Canada","H1W 1B2","45.5420889","-73.5610953","Rue Sherbrooke Est / Rue Rachel","114463",NULL,"<p>Centre Commercial Maisonneuve is located 20 minutes away from Montreal&rsquo;s downtown core. Situated between 2 major bus serviced thoroughfares, this well situated property is easily accessible in this densely populated east end community. Anchored by Provigo, Canadian Tire and TD Canada Trust, this centre provides residents with their everyday shopping needs.</p>
","https://fcr.ca/uploads/properties/marketing-pdfs/Centre_Commercial_Maisonneuve.pdf",,"https://fcr.ca/uploads//properties/site-plans/Centre Commercial Maisonneuve.pdf","22200","30939","16958","60296","232926","129971","61832","521348","276106","65165",,,,"0","0","0","0","0","0","0","0","0","0","1","1","0","0","54","0",,,,,,,,"<p>Centre Commercial Maisonneuve est situ&eacute; &agrave; 20 minutes du centre-ville de Montr&eacute;al.&nbsp;Situ&eacute;e entre deux grands axes servient par les autobus, cette propri&eacute;t&eacute; bien situ&eacute;e est facilement accessible dans cette communaut&eacute; &agrave; l&#39;est.&nbsp;Ancr&eacute; par Provigo, Canadian Tire et TD Canada Trust, ce centre offre aux r&eacute;sidents leurs besoins quotidiens de magasinage. <!-- P--></p>
"
"148","EED663","https://fcr.ca/uploads/properties/thumbs/EED663_Thumb.jpg","https://fcr.ca/uploads/properties/hero/EED663_Ground2.jpg","Edifice Hooper","Edifice Hooper","1","1",NULL,"1","731-775 rue Galt Ouest",,"Sherbrooke","QC","eastern","Canada","J1H 1Z1","45.3939346","-71.8976336","Rue Des Ormeaux / Rue Galt Ouest","93489",NULL,"<p>Edifice Hooper is situated near the confluence of Saint-Francois and Magog rivers in the city of Sherbrooke. With a rustic red brick exterior, this charming urban building offers space for both retail and professional offices. Anchored by IGA Extra and Familiprix, this centre offers ample parking and everyday shopping needs for the residents of this growing community.</p>
","https://fcr.ca/uploads/properties/marketing-pdfs/Edifice Hooper_Group-Brochure (1).pdf",,"https://fcr.ca/uploads//properties/site-plans/Edifice Hooper (1).pdf","9800","10869","6385","39827","58007","30242","51781","103677","52082","59317",,,,"3879","10150","0","0","0","0","0","0","0","0","1","1","1","0","74","0",,,,,,,,"<p>L&#39;&eacute;difice Hooper est situ&eacute; pr&egrave;s de la confluence des rivi&egrave;res Saint-Fran&ccedil;ois et Magog, dans la ville de Sherbrooke.&nbsp;Dot&eacute; d&#39;un ext&eacute;rieur rustique en briques rouges, ce b&acirc;timent urbain charmant offre un espace pour les bureaux de vente au d&eacute;tail et professionnels.&nbsp;Ancr&eacute; par IGA Extra et Familiprix, ce centre offre un grand parking et des besoins d&#39;achats quotidiens pour les r&eacute;sidents de cette communaut&eacute; en pleine croissance. <!-- P--></p>
"
"149","ECB477","https://fcr.ca/uploads//properties/thumbs/ECB477_Thumb.jpg","https://fcr.ca/uploads//properties/hero/ECB477_header.jpg","Carrefour Belvedere","Carrefour Belvedere","0","1",NULL,"0","385-419 rue Belvdre Sud",,"Sherbrooke","QC","eastern","Canada","J1H 4B7","45.3955772","-71.8963543","Rue Belvdre Sud / Rue King Ouest","2720",NULL,"<p>Welcome to Carrefour Belvedere! Be part of one of the most exiting commercial projects to be constructed in the neighbourhood of Sherbrooke. Located on Belv&eacute;d&egrave;re near Galt West, this well situated property will be an extraordinary shopping destination in this growing area.</p>
","https://fcr.ca/uploads/properties/marketing-pdfs/Edifice Hooper_Group-Brochure (1).pdf",,"https://fcr.ca/uploads//properties/site-plans/Belvedere-Carrefour-11182_Carrefour Belvedere.pdf","9800","10412","6111","39995","59970","31202","51677","104151","52345","59114",,,,"0","0","0","0","0","0","0","0","0","0","0","0","0","1","36","0","Carrefour Belvedere",,,,,,,"<p><span font-size:="""" helvetica="""" style=""font-family: adelle, "">Bienvenue au Carrefour Belv&eacute;d&egrave;re, l&#39;un des projets commerciaux les plus excitants de la ville de Sherbrooke. Situ&eacute; sur la rue Belv&eacute;d&egrave;re pr&egrave;s de Galt Ouest, cet &eacute;tablissement bien situ&eacute; est une destination de magasinage de choix dans un quartier qui continue &agrave; se d&eacute;velopper.</span> <!-- P--></p>
"
"150","EAS855","https://fcr.ca/uploads//properties/thumbs/EAS855_Thumb.jpg","https://fcr.ca/uploads/properties/hero/EAS855_Ground2.jpg","Atrium du Sanctuaire","Atrium du Sanctuaire","1","1",NULL,"0","6100 avenue du Bois",,"Montral","QC","eastern","Canada","H3S 2W1","45.5103625","-73.6218625","Avenue Van Horne / Avenue Wilderton","37971",NULL,"<p>Nested in the heart of the Cote des Neiges neighbourhood experiencing rapid growth is Atrium du Sanctuaire - a medical building offering medical and professional work space. This culturally diverse family neighbourhood is densely populated and surrounded by residential development.</p>
","https://fcr.ca/uploads/properties/marketing-pdfs/Centre Commercial Wilderton.pdf",,"https://fcr.ca/uploads//properties/site-plans/Atrium_du_Sanctuaire.pdf","11730","29647","13148","92782","208190","91755","87237","621198","302511","78005",,,,"932","1392","0","0","0","0","0","0","0","0","0","0","1","0","18","0",,,,,,,,"<p><span font-size:="""" helvetica="""" style=""font-family: adelle, "">L&rsquo;Atrium du Sanctuaire est un b&acirc;timent m&eacute;dical qui offre un espace de travail pour divers professionnels de la sant&eacute; et abrite quelques commerces. Au c&oelig;ur de C&ocirc;te-des-Neiges, quartier culturellement diversifi&eacute; orient&eacute; vers la famille, ce centre est entour&eacute; par le d&eacute;veloppement r&eacute;sidentiel.</span> <!-- P--></p>
"
"151","ECC283","https://fcr.ca/uploads/properties/thumbs/ECC283_Thumb.jpg","https://fcr.ca/uploads//properties/hero/ECC283_header.jpg","Centre Commercial Cote St-Luc","Centre Commercial Cote St-Luc","1","1",NULL,"0","7155 chemin Cte St-Luc",,"Cte St-Luc","QC","eastern","Canada","H4V 1J2","45.4656817","-73.6553141","Chemin Cte St-Luc / Avenue Silverson","184034",NULL,"<p>Nestled in the heart of an affluent community experiencing rapid growth is Centre Commercial Cote St-Luc. This culturally diverse family neighbourhood is densely populated and surrounded by residential development. Offering an array of amenities and services, this centre is anchored by IGA, SAQ, RBC and the largest Jean Coutu in Quebec.</p>
","https://fcr.ca/uploads/properties/marketing-pdfs/Centre Commercial Cote St-Luc.pdf",,"https://fcr.ca/uploads//properties/site-plans/Centre_Commercial_Cte_St-Luc (1).pdf","13130","25028","10256","72366","126924","55896","85890","331976","146073","79590",,,,"3200","1997","4217","4021","1500","1073","4126","0","0","0","1","1","1","0","52","0",,,,,,,,"<p><span font-size:="""" helvetica="""" style=""font-family: adelle, "">Le Centre Commercial C&ocirc;te St-Luc est situ&eacute; au c&oelig;ur d&rsquo;une communaut&eacute; qui conna&icirc;t une croissance rapide. Ce quartier orient&eacute; vers la famille et culturellement diversifi&eacute; est aussi dens&eacute;ment peupl&eacute; et caract&eacute;ris&eacute; par le d&eacute;veloppement r&eacute;sidentiel. De grands noms se trouvent au centre tels que IGA, SAQ, RBC et on y trouve &eacute;galement la plus grande succursale de Jean Coutu au Qu&eacute;bec.</span><!-- P--></p>
"
"152","EPF383","https://fcr.ca/uploads/properties/thumbs/EPF383_Thumb.jpg","https://fcr.ca/uploads/properties/hero/EPF383_Ground3.jpg","Place Fleury","Place Fleury","1","1",NULL,"0","1745 rue Fleury Est",,"Montral","QC","eastern","Canada","H2C 1T3","45.5669565","-73.6544999","Avenue Papineau / Rue Fleury Est","120197",NULL,"<p><span font-size:="""" helvetica="""" style=""font-family: adelle, "">Place Fleury is located towards the north end of Montreal, in the Ahuntsic-Cartierville community. Situated in a highly populated mature neighbourhood, this centre offers a variety of amenities to the local residents and surrounding areas. Anchored by Metro and Pharmaprix, Place Fleury has ample parking and provides convenient shopping for everyday essentials.</span></p>
","https://fcr.ca/uploads/properties/marketing-pdfs/Place_Fleury.pdf",,"https://fcr.ca/uploads//properties/site-plans/Place_Fleury_.pdf","3880","21653","10659","65285","150081","68319","64048","455046","202152","61877",,,,"596","1891","0","0","0","0","0","0","0","0","1","1","0","0","170","0",,,,,,,,"<p><span font-size:="""" helvetica="""" style=""font-family: adelle, "">La Place Fleury est situ&eacute;e au nord-ouest de Montr&eacute;al, dans la communaut&eacute; Ahuntsic-Cartierville. Situ&eacute;e dans un quartier r&eacute;sidentiel et d&eacute;velopp&eacute;, ce centre &ndash; qui fait partie int&eacute;grante de la Promenade Fleury &ndash; offre une vari&eacute;t&eacute; de commerces pour les r&eacute;sidents locaux et des r&eacute;gions avoisinantes, dont un march&eacute; M&eacute;tro ainsi qu&rsquo;un Pharmaprix. Le stationnement &agrave; l&rsquo;arri&egrave;re bonifie l&rsquo;exp&eacute;rience de magasinage pour les essentiels de la vie quotidienne.</span> <!-- P--></p>
"
"153","EFD337",NULL,"https://stage.fcr.ca/uploads//properties/hero/Fleury_Dollarama.JPG","Place Fleury","Fleury Dollarama","1","1",NULL,"0","1780 rue Fleury Est",,"Montral","QC","eastern","Canada","H2C 1T4","45.5674228","-73.6535553","Avenue Papineau / Rue Fleury Est","17085",NULL,"<p>Located adjacent to Place Fleury and in close proximity to Fleury Renaud-Bray, this centre offers ample parking, conveniently serving the residents of Ahuntsic-Cartierviel.</p>
","https://fcr.ca/uploads/properties/marketing-pdfs/Place_Fleury.pdf",,"https://stage.fcr.ca/uploads//properties/site-plans/Fleury-Dollarama-10484-_CURRENT-SITE-PLAN.pdf","3880","22593","11079","64158","152218","69023","63311","459071","203812","61640",,,,"6780","0","0","0","0","0","0","0","0","0","0","1","1","0","171","0",,,,,,,,"<p>Situ&eacute; &agrave; c&ocirc;t&eacute; de la Place Fleury et &agrave; proximit&eacute; de Fleury Renaud-Bray, ce centre offre un grand lieu de stationnement, servant commod&eacute;ment aux r&eacute;sidents de Ahuntsic-Cartierviel. <!-- P--></p>
"
"154","EFR392","https://fcr.ca/uploads/properties/thumbs/EFR392_Thumb.jpg","https://fcr.ca/uploads/properties/hero/EFR392_Ground1.jpg","Place Fleury","Fleury Renaud-Bray","1","1",NULL,"0","1685-1691 rue Fleury Est",,"Montral","QC","eastern","Canada","H2C 1T1","45.5660411","-73.6547566","Rue Garnier / Rue Fleury Est","39127",NULL,"<p><span font-size:="""" helvetica="""" style=""font-family: adelle, "">Serving the dynamic and densely populated Ahuntsic-Cartierville community is Fleury Renaud-Bray. Located in close proximity to the busy Avenue Papineau and adjacent to Place Fleury, this centre is well situated and easily accessible. This three level building offers professional office space and ground floor retail shopping for local residents.</span></p>
","https://fcr.ca/uploads/properties/marketing-pdfs/Place_Fleury.pdf",,"https://fcr.ca/uploads//properties/site-plans/Place_Fleury.pdf","3880","21478","10520","65681","149495","68113","64160","459589","204181","62112",,,,"170","148","156","623","272","181","126","0","0","0","0","0","1","0","172","0",,,,,,,,"<p><span font-size:="""" helvetica="""" style=""font-family: adelle, "">La Place Fleury Renaud-Bray est situ&eacute;e au nord-ouest de Montr&eacute;al, dans la communaut&eacute; Ahuntsic-Cartierville. Situ&eacute;e dans un quartier r&eacute;sidentiel et facilement accessible, ce centre &ndash; qui fait partie de la Promenade Fleury &ndash; est situ&eacute; &agrave; c&ocirc;t&eacute; de la Place Fleury. Ce b&acirc;timent offre des espaces de bureau ainsi que des commerces de d&eacute;tails pour les r&eacute;sidents locaux.</span> <!-- P--></p>
"
"155","ECC724","https://fcr.ca/uploads/properties/thumbs/ECC724_Thumb.jpg","https://fcr.ca/uploads/properties/hero/ECC724_Ground3.jpg","Centre Commercial Domaine","Centre Commercial Domaine","1","1",NULL,"0","3365 avenue de Granby",,"Montral","QC","eastern","Canada","H1N 2Z7","45.5808823","-73.5428608","Avenue de Granby / Rue Sherbrooke","211794",NULL,"<p>Centre Commercial Domaine is one of the oldest standing shopping centres in Montreal. With renovations throughout the years, this centre has become a modernized shopping destination anchored by Metro, Walmart, and Uniprix. Strategically located on the busy street of Rue Sherbrooke Est. and in close proximity to the Langelier Metro Station, this centre is easily accessible and offers high traffic counts. Offering an array of amenities, this location now provides a complete shopping experience for the residents of this growing community.</p>
","https://fcr.ca/uploads/properties/marketing-pdfs/Centre_commercial_domaine.pdf",,"https://fcr.ca/uploads//properties/site-plans/Centre_Commercial_Domaine.pdf","36110","20668","10436","61358","135952","65428","65322","345324","167089","62306",,,,"1857","503","1236","0","0","0","0","0","0","0","0","0","1","0","53","0",,,,,,,,"<p><span font-size:="""" helvetica="""" style=""font-family: adelle, "">Le Centre Commercial Domaine est l&rsquo;un des plus anciens centres commerciaux de Montr&eacute;al. Le march&eacute; M&eacute;tro et le Walmart occupent les deux extr&eacute;mit&eacute;s de ce centre qui est strat&eacute;giquement situ&eacute; pr&egrave;s de la station de m&eacute;tro Langelier, au coin des rues Sherbrooke Est et Langelier. Offrant une gamme vari&eacute;e de commerces, cet emplacement offre une exp&eacute;rience de magasinage compl&egrave;te pour les r&eacute;sidents du quartier environnant, lequel est en pleine croissance.</span> <!-- P--></p>
"
